Subject,Answer,Sentence,Age,Gender,Language,Item,Noun,Polarity
y4bg0frxdfmy9t8,tree,"She wants no cypress, but she wants %%.",25,female,english,24,cypress,0
y4bg0frxdfmy9t8,books,"She wants no library, but she wants %%.",25,female,english,48,library,0
y4bg0frxdfmy9t8,water,I want a trout and I want %%.,25,female,english,42,trout,1
y4bg0frxdfmy9t8,honey,We want a hornet and we want %%.,25,female,english,36,hornet,1
y4bg0frxdfmy9t8,pant,"He wants no shirt, but he wants %%.",25,female,english,10,shirt,0
y4bg0frxdfmy9t8,eagle,"They want no falcon, but they want %%.",25,female,english,8,falcon,0
y4bg0frxdfmy9t8,bee,"She wants no wasp, but she wants %%.",25,female,english,23,wasp,0
y4bg0frxdfmy9t8,cup,"He wants no mug, but he wants %%.",25,female,english,43,mug,0
y4bg0frxdfmy9t8,duck,"You want no swan, but you want %%.",25,female,english,17,swan,0
y4bg0frxdfmy9t8,duck,"I want no goose, but I want %%.",25,female,english,5,goose,0
y4bg0frxdfmy9t8,parrot,"She wants no sparrow, but she wants %%.",25,female,english,41,sparrow,0
y4bg0frxdfmy9t8,knife,"They want no dagger, but they want %%.",25,female,english,21,dagger,0
y4bg0frxdfmy9t8,water,We want a giraffe and we want %%.,25,female,english,35,giraffe,1
y4bg0frxdfmy9t8,home,"She wants no castle, but she wants %%.",25,female,english,47,castle,0
y4bg0frxdfmy9t8,rack,She wants a television and she wants %%.,25,female,english,44,television,1
y4bg0frxdfmy9t8,cutter,She wants a potato and she wants %%.,25,female,english,37,potato,1
y4bg0frxdfmy9t8,music,They want a radio and they want %%.,25,female,english,46,radio,1
y4bg0frxdfmy9t8,fish,"I want no goldfish, but I want %%.",25,female,english,30,goldfish,0
y4bg0frxdfmy9t8,toaster,"She wants no oven, but she wants %%.",25,female,english,31,oven,0
y4bg0frxdfmy9t8,rabbit,"She wants no deer, but she wants %%.",25,female,english,12,deer,0
y4bg0frxdfmy9t8,petrol,He wants a scooter and he wants %%.,25,female,english,33,scooter,1
y4bg0frxdfmy9t8,hen,We want a goat and we want %%.,25,female,english,1,goat,1
y4bg0frxdfmy9t8,ice,"He wants no freezer, but he wants %%.",25,female,english,22,freezer,0
y4bg0frxdfmy9t8,water,I want an alligator and I want %%.,25,female,english,2,alligator,1
y4bg0frxdfmy9t8,boat,He wants a ferry and he wants %%.,25,female,english,19,ferry,1
pbbr8y4oxowlhbe,cabbage,"He wants no broccoli, but he wants %%.",31,male,english,15,broccoli,0
pbbr8y4oxowlhbe,reptiles,She wants an alligator and she wants %%.,31,male,english,2,alligator,1
pbbr8y4oxowlhbe,fries,They want a potato and they want %%.,31,male,english,37,potato,1
pbbr8y4oxowlhbe,vacation,I want a yacht and I want %%.,31,male,english,4,yacht,1
pbbr8y4oxowlhbe,berries,"She wants no cranberry, but she wants %%.",31,male,english,29,cranberry,0
pbbr8y4oxowlhbe,prince,"We want no frog, but we want %%.",31,male,english,45,frog,0
pbbr8y4oxowlhbe,tablets,She wants a television and she wants %%.,31,male,english,44,television,1
pbbr8y4oxowlhbe,tales,He wants a ferry and he wants %%.,31,male,english,19,ferry,1
pbbr8y4oxowlhbe,beds,"They want no chair, but they want %%.",31,male,english,3,chair,0
pbbr8y4oxowlhbe,party,"You want no poplar, but you want %%.",31,male,english,49,poplar,0
pbbr8y4oxowlhbe,nothing,He wants a beaver and he wants %%.,31,male,english,38,beaver,1
pbbr8y4oxowlhbe,sling,You want a bag and you want %%.,31,male,english,16,bag,1
pbbr8y4oxowlhbe,tuba,"We want no flute, but we want %%.",31,male,english,28,flute,0
pbbr8y4oxowlhbe,bear,"You want no deer, but you want %%.",31,male,english,12,deer,0
pbbr8y4oxowlhbe,car,You want a truck and you want %%.,31,male,english,11,truck,1
pbbr8y4oxowlhbe,eagles,"I want no hawk, but I want %%.",31,male,english,32,hawk,0
pbbr8y4oxowlhbe,oven,"He wants no toaster, but he wants %%.",31,male,english,6,toaster,0
pbbr8y4oxowlhbe,violin,"You want no trumpet, but you want %%.",31,male,english,26,trumpet,0
pbbr8y4oxowlhbe,home,She wants a castle and she wants %%.,31,male,english,47,castle,1
pbbr8y4oxowlhbe,flour,You want a sieve and you want %%.,31,male,english,50,sieve,1
pbbr8y4oxowlhbe,jersey,She wants a hornet and she wants %%.,31,male,english,36,hornet,1
pbbr8y4oxowlhbe,onions,"I want no garlic, but I want %%.",31,male,english,14,garlic,0
pbbr8y4oxowlhbe,sleeves,"They want no shirt, but they want %%.",31,male,english,10,shirt,0
pbbr8y4oxowlhbe,yellow,"She wants no bus, but she wants %%.",31,male,english,9,bus,0
pbbr8y4oxowlhbe,eagle,"She wants no falcon, but she wants %%.",31,male,english,8,falcon,0
pbbr8y4oxowlhbe,rides,"We want no scooter, but we want %%.",31,male,english,33,scooter,0
pbbr8y4oxowlhbe,tress,"She wants no cypress, but she wants %%.",31,male,english,24,cypress,0
pbbr8y4oxowlhbe,books,We want a library and we want %%.,31,male,english,48,library,1
pbbr8y4oxowlhbe,pants,They want a trout and they want %%.,31,male,english,42,trout,1
pbbr8y4oxowlhbe,grains,I want a crow and I want %%.,31,male,english,34,crow,1
pbbr8y4oxowlhbe,allergies,"We want no wasp, but we want %%.",31,male,english,23,wasp,0
pbbr8y4oxowlhbe,clean,I want a cat and I want %%.,31,male,english,18,cat,1
pbbr8y4oxowlhbe,milk,"We want no goat, but we want %%.",31,male,english,1,goat,0
pbbr8y4oxowlhbe,insects,He wants a lizard and he wants %%.,31,male,english,25,lizard,1
pbbr8y4oxowlhbe,deers,"I want no goose, but I want %%.",31,male,english,5,goose,0
pbbr8y4oxowlhbe,news,He wants a radio and he wants %%.,31,male,english,46,radio,1
pbbr8y4oxowlhbe,skirt,"She wants no dress, but she wants %%.",31,male,english,20,dress,0
pbbr8y4oxowlhbe,trees,"I want no giraffe, but I want %%.",31,male,english,35,giraffe,0
pbbr8y4oxowlhbe,vitamins,"She wants no lemon, but she wants %%.",31,male,english,40,lemon,0
pbbr8y4oxowlhbe,coffee,He wants a mug and he wants %%.,31,male,english,43,mug,1
pbbr8y4oxowlhbe,sharp,"I want no dagger, but I want %%.",31,male,english,21,dagger,0
pbbr8y4oxowlhbe,cold,She wants a freezer and she wants %%.,31,male,english,22,freezer,1
pbbr8y4oxowlhbe,lake,They want a swan and they want %%.,31,male,english,17,swan,1
pbbr8y4oxowlhbe,wine,We want a bottle and we want %%.,31,male,english,39,bottle,1
pbbr8y4oxowlhbe,jack,"You want no sparrow, but you want %%.",31,male,english,41,sparrow,0
pbbr8y4oxowlhbe,toast,They want an oven and they want %%.,31,male,english,31,oven,1
c3jjftfj16pp9rq,part,"We want no trout, but we want %%.",40,male,english,42,trout,0
c3jjftfj16pp9rq,bear,"He wants no beaver, but he wants %%.",40,male,english,38,beaver,0
ne73ojm8rhj3rf1,dress,She wants a yacht and she wants %%.,32,female,english,4,yacht,1
ne73ojm8rhj3rf1,sword,"We want no dagger, but we want %%.",32,female,english,21,dagger,0
ne73ojm8rhj3rf1,radio,"She wants no television, but she wants %%.",32,female,english,44,television,0
ne73ojm8rhj3rf1,flatbed,They want a truck and they want %%.,32,female,english,11,truck,1
ne73ojm8rhj3rf1,peas,She wants corn and she wants %%.,32,female,english,7,corn,1
ne73ojm8rhj3rf1,eggs,He wants a goose and he wants %%.,32,female,english,5,goose,1
ne73ojm8rhj3rf1,leaves,He wants a cypress and he wants %%.,32,female,english,24,cypress,1
ne73ojm8rhj3rf1,pants,We want a shirt and we want %%.,32,female,english,10,shirt,1
ne73ojm8rhj3rf1,elk,"They want no deer, but they want %%.",32,female,english,12,deer,0
ne73ojm8rhj3rf1,ice,I want a freezer and I want %%.,32,female,english,22,freezer,1
ne73ojm8rhj3rf1,cage,She wants a falcon and she wants %%.,32,female,english,8,falcon,1
ne73ojm8rhj3rf1,onion,"I want no potato, but I want %%.",32,female,english,37,potato,0
ne73ojm8rhj3rf1,cage,They want a hawk and they want %%.,32,female,english,32,hawk,1
ne73ojm8rhj3rf1,wig,He wants a dress and he wants %%.,32,female,english,20,dress,1
ne73ojm8rhj3rf1,stand,She wants a trumpet and she wants %%.,32,female,english,26,trumpet,1
ne73ojm8rhj3rf1,loan,I want a bus and I want %%.,32,female,english,9,bus,1
ne73ojm8rhj3rf1,helmet,He wants a scooter and he wants %%.,32,female,english,33,scooter,1
ne73ojm8rhj3rf1,glass,"I want no mug, but I want %%.",32,female,english,43,mug,0
ne73ojm8rhj3rf1,sweater,"They want no coat, but they want %%.",32,female,english,27,coat,0
ne73ojm8rhj3rf1,mansion,"You want no castle, but you want %%.",32,female,english,47,castle,0
ne73ojm8rhj3rf1,drain,You want a sieve and you want %%.,32,female,english,50,sieve,1
ne73ojm8rhj3rf1,spice,"She wants no garlic, but she wants %%.",32,female,english,14,garlic,0
ne73ojm8rhj3rf1,stand,She wants a flute and she wants %%.,32,female,english,28,flute,1
ne73ojm8rhj3rf1,lemon,We want a trout and we want %%.,32,female,english,42,trout,1
ne73ojm8rhj3rf1,cup,"I want no bottle, but I want %%.",32,female,english,39,bottle,0
ne73ojm8rhj3rf1,raven,"She wants no crow, but she wants %%.",32,female,english,34,crow,0
ne73ojm8rhj3rf1,toad,She wants a frog and she wants %%.,32,female,english,45,frog,1
ne73ojm8rhj3rf1,duck,You want a swan and you want %%.,32,female,english,17,swan,1
ne73ojm8rhj3rf1,purse,"I want no bag, but I want %%.",32,female,english,16,bag,0
ne73ojm8rhj3rf1,dog,She wants a cat and she wants %%.,32,female,english,18,cat,1
ne73ojm8rhj3rf1,tv,We want a radio and we want %%.,32,female,english,46,radio,1
ne73ojm8rhj3rf1,bush,They want a poplar and they want %%.,32,female,english,49,poplar,1
ne73ojm8rhj3rf1,robin,"They want no sparrow, but they want %%.",32,female,english,41,sparrow,0
ne73ojm8rhj3rf1,wasp,I want a hornet and I want %%.,32,female,english,36,hornet,1
ne73ojm8rhj3rf1,guppy,"We want no goldfish, but we want %%.",32,female,english,30,goldfish,0
ne73ojm8rhj3rf1,lime,We want a lemon and we want %%.,32,female,english,40,lemon,1
ne73ojm8rhj3rf1,bookstore,"She wants no library, but she wants %%.",32,female,english,48,library,0
ne73ojm8rhj3rf1,tank,They want a lizard and they want %%.,32,female,english,25,lizard,1
ne73ojm8rhj3rf1,dessert,"She wants no broccoli, but she wants %%.",32,female,english,15,broccoli,0
ne73ojm8rhj3rf1,sofa,"They want no chair, but they want %%.",32,female,english,3,chair,0
ne73ojm8rhj3rf1,sweater,"We want no jacket, but we want %%.",32,female,english,13,jacket,0
ne73ojm8rhj3rf1,apple,She wants a cranberry and she wants %%.,32,female,english,29,cranberry,1
ne73ojm8rhj3rf1,yacht,"I want no ferry, but I want %%.",32,female,english,19,ferry,0
ne73ojm8rhj3rf1,elephant,"They want no giraffe, but they want %%.",32,female,english,35,giraffe,0
ne73ojm8rhj3rf1,hedgehog,She wants a beaver and she wants %%.,32,female,english,38,beaver,1
ne73ojm8rhj3rf1,stove,You want an oven and you want %%.,32,female,english,31,oven,1
ne73ojm8rhj3rf1,crocodile,"He wants no alligator, but he wants %%.",32,female,english,2,alligator,0
ne73ojm8rhj3rf1,horse,"They want no goat, but they want %%.",32,female,english,1,goat,0
ne73ojm8rhj3rf1,oven,"He wants no toaster, but he wants %%.",32,female,english,6,toaster,0
ne73ojm8rhj3rf1,hornet,He wants a wasp and he wants %%.,32,female,english,23,wasp,1
sp9rqs0592valov,food,"We want no falcon, but we want %%.",30,female,english,8,falcon,0
sp9rqs0592valov,ypress,She wants a cypress and she wants %%.,30,female,english,24,cypress,1
sp9rqs0592valov,reading,"He wants no library, but he wants %%.",30,female,english,48,library,0
sp9rqs0592valov,wood,You want a chair and you want %%.,30,female,english,3,chair,1
sp9rqs0592valov,fm,"She wants no radio, but she wants %%.",30,female,english,46,radio,0
c4hc5x5zwm7m17z,swap,"You want no wasp, but you want %%.",30,male,english,23,wasp,0
145dsml38sxs8wh,crown,"We want no crow, but we want %%.",30,female,english,34,crow,0
5gqx7odg41gg8ed,pets,I want a giraffe and I want %%.,30,female,english,35,giraffe,1
5gqx7odg41gg8ed,taste,"She wants no toaster, but she wants %%.",30,female,english,6,toaster,0
5gqx7odg41gg8ed,cat,"I want no frog, but I want %%.",30,female,english,45,frog,0
5gqx7odg41gg8ed,net,"I want no hornet, but I want %%.",30,female,english,36,hornet,0
5gqx7odg41gg8ed,shirt,"We want no sieve, but we want %%.",30,female,english,50,sieve,0
5gqx7odg41gg8ed,frees,She wants a freezer and she wants %%.,30,female,english,22,freezer,1
5gqx7odg41gg8ed,chips,"He wants no potato, but he wants %%.",30,female,english,37,potato,0
5gqx7odg41gg8ed,gator,He wants an alligator and he wants %%.,30,female,english,2,alligator,1
5gqx7odg41gg8ed,bike,They want a bus and they want %%.,30,female,english,9,bus,1
5gqx7odg41gg8ed,cup,"We want no mug, but we want %%.",30,female,english,43,mug,0
5gqx7odg41gg8ed,cast,He wants a castle and he wants %%.,30,female,english,47,castle,1
5gqx7odg41gg8ed,car,You want a truck and you want %%.,30,female,english,11,truck,1
5gqx7odg41gg8ed,top,He wants a dress and he wants %%.,30,female,english,20,dress,1
5gqx7odg41gg8ed,chicken,We want a goldfish and we want %%.,30,female,english,30,goldfish,1
5gqx7odg41gg8ed,flower,She wants corn and she wants %%.,30,female,english,7,corn,1
5gqx7odg41gg8ed,piano,"They want no flute, but they want %%.",30,female,english,28,flute,0
5gqx7odg41gg8ed,boat,"He wants no coat, but he wants %%.",30,female,english,27,coat,0
5gqx7odg41gg8ed,radio,"We want no television, but we want %%.",30,female,english,44,television,0
5gqx7odg41gg8ed,jerry,"You want no ferry, but you want %%.",30,female,english,19,ferry,0
5gqx7odg41gg8ed,can,She wants a bag and she wants %%.,30,female,english,16,bag,1
5gqx7odg41gg8ed,tv,He wants a radio and he wants %%.,30,female,english,46,radio,1
5gqx7odg41gg8ed,cook,"He wants no goose, but he wants %%.",30,female,english,5,goose,0
5gqx7odg41gg8ed,juice,You want a lemon and you want %%.,30,female,english,40,lemon,1
5gqx7odg41gg8ed,frog,"We want no crow, but we want %%.",30,female,english,34,crow,0
5gqx7odg41gg8ed,ban,"He wants no swan, but he wants %%.",30,female,english,17,swan,0
5gqx7odg41gg8ed,pant,They want a shirt and they want %%.,30,female,english,10,shirt,1
5gqx7odg41gg8ed,pet,"We want no trumpet, but we want %%.",30,female,english,26,trumpet,0
5gqx7odg41gg8ed,con,They want a falcon and they want %%.,30,female,english,8,falcon,1
5gqx7odg41gg8ed,bike,She wants a scooter and she wants %%.,30,female,english,33,scooter,1
5gqx7odg41gg8ed,jerry,He wants a cranberry and he wants %%.,30,female,english,29,cranberry,1
5gqx7odg41gg8ed,trust,They want a trout and they want %%.,30,female,english,42,trout,1
5gqx7odg41gg8ed,beer,I want a deer and I want %%.,30,female,english,12,deer,1
5gqx7odg41gg8ed,water,They want a bottle and they want %%.,30,female,english,39,bottle,1
5gqx7odg41gg8ed,board,You want a goat and you want %%.,30,female,english,1,goat,1
5gqx7odg41gg8ed,rat,He wants a cat and he wants %%.,30,female,english,18,cat,1
5gqx7odg41gg8ed,press,"You want no cypress, but you want %%.",30,female,english,24,cypress,0
qj1xcjo32unlx29,wants,"He wants no wasp, but he wants %%.",31,male,english,23,wasp,0
x6e80jnfws5ncqc,flour,She wants a sieve and she wants %%.,47,male,english,50,sieve,1
x6e80jnfws5ncqc,meat,"I want no coat, but I want %%.",47,male,english,27,coat,0
x6e80jnfws5ncqc,water,He wants a ferry and he wants %%.,47,male,english,19,ferry,1
x6e80jnfws5ncqc,boxing,She wants a dagger and she wants %%.,47,male,english,21,dagger,1
x6e80jnfws5ncqc,meat,I want a goat and I want %%.,47,male,english,1,goat,1
x6e80jnfws5ncqc,snake,You want a lizard and you want %%.,47,male,english,25,lizard,1
x6e80jnfws5ncqc,birds,"She wants no crow, but she wants %%.",47,male,english,34,crow,0
x6e80jnfws5ncqc,singing,We want a sparrow and we want %%.,47,male,english,41,sparrow,1
x6e80jnfws5ncqc,water,"You want no mug, but you want %%.",47,male,english,43,mug,0
x6e80jnfws5ncqc,ocean,You want an alligator and you want %%.,47,male,english,2,alligator,1
x6e80jnfws5ncqc,bread,You want a toaster and you want %%.,47,male,english,6,toaster,1
x6e80jnfws5ncqc,bike,"She wants no scooter, but she wants %%.",47,male,english,33,scooter,0
x6e80jnfws5ncqc,juice,I want a lemon and I want %%.,47,male,english,40,lemon,1
x6e80jnfws5ncqc,purse,"They want no bag, but they want %%.",47,male,english,16,bag,0
x6e80jnfws5ncqc,honey,"I want no hornet, but I want %%.",47,male,english,36,hornet,0
x6e80jnfws5ncqc,wood,"She wants no poplar, but she wants %%.",47,male,english,49,poplar,0
x6e80jnfws5ncqc,duck,He wants a swan and he wants %%.,47,male,english,17,swan,1
x6e80jnfws5ncqc,dress,He wants a jacket and he wants %%.,47,male,english,13,jacket,1
x6e80jnfws5ncqc,animal,"They want no beaver, but they want %%.",47,male,english,38,beaver,0
x6e80jnfws5ncqc,pant,"You want no shirt, but you want %%.",47,male,english,10,shirt,0
x6e80jnfws5ncqc,strawberry,I want a cranberry and I want %%.,47,male,english,29,cranberry,1
x6e80jnfws5ncqc,swan,"She wants no falcon, but she wants %%.",47,male,english,8,falcon,0
x6e80jnfws5ncqc,maize,She wants corn and she wants %%.,47,male,english,7,corn,1
x6e80jnfws5ncqc,lorry,"I want no truck, but I want %%.",47,male,english,11,truck,0
x6e80jnfws5ncqc,sail,"You want no yacht, but you want %%.",47,male,english,4,yacht,0
x6e80jnfws5ncqc,song,"They want no radio, but they want %%.",47,male,english,46,radio,0
x6e80jnfws5ncqc,milk,You want a cat and you want %%.,47,male,english,18,cat,1
x6e80jnfws5ncqc,water,We want a bottle and we want %%.,47,male,english,39,bottle,1
x6e80jnfws5ncqc,frock,"She wants no dress, but she wants %%.",47,male,english,20,dress,0
x6e80jnfws5ncqc,book,They want a library and they want %%.,47,male,english,48,library,1
x6e80jnfws5ncqc,cauliflower,She wants broccoli and she wants %%.,47,male,english,15,broccoli,1
x6e80jnfws5ncqc,account,"He wants no cypress, but he wants %%.",47,male,english,24,cypress,0
x6e80jnfws5ncqc,honey,"She wants no wasp, but she wants %%.",47,male,english,23,wasp,0
x6e80jnfws5ncqc,cake,They want an oven and they want %%.,47,male,english,31,oven,1
x6e80jnfws5ncqc,travel,"You want no bus, but you want %%.",47,male,english,9,bus,0
x6e80jnfws5ncqc,swan,"She wants no goose, but she wants %%.",47,male,english,5,goose,0
x6e80jnfws5ncqc,birds,"She wants no hawk, but she wants %%.",47,male,english,32,hawk,0
x6e80jnfws5ncqc,skin,We want a deer and we want %%.,47,male,english,12,deer,1
x6e80jnfws5ncqc,ice,"He wants no freezer, but he wants %%.",47,male,english,22,freezer,0
x6e80jnfws5ncqc,chips,I want a potato and I want %%.,47,male,english,37,potato,1
x6e80jnfws5ncqc,pickle,She wants garlic and she wants %%.,47,male,english,14,garlic,1
x6e80jnfws5ncqc,movie,"They want no castle, but they want %%.",47,male,english,47,castle,0
x6e80jnfws5ncqc,grass,They want a giraffe and they want %%.,47,male,english,35,giraffe,1
x6e80jnfws5ncqc,food,We want a trout and we want %%.,47,male,english,42,trout,1
x6e80jnfws5ncqc,elephant,"I want no trumpet, but I want %%.",47,male,english,26,trumpet,0
x6e80jnfws5ncqc,hop,You want a frog and you want %%.,47,male,english,45,frog,1
zjm7auwb3uofyxx,pant,"We want no shirt, but we want %%.",40,male,english,10,shirt,0
zjm7auwb3uofyxx,phone,We want a radio and we want %%.,40,male,english,46,radio,1
zjm7auwb3uofyxx,duck,"You want no swan, but you want %%.",40,male,english,17,swan,0
zjm7auwb3uofyxx,bottles,"You want no bottle, but you want %%.",40,male,english,39,bottle,0
zjm7auwb3uofyxx,castles,"They want no castle, but they want %%.",40,male,english,47,castle,0
zjm7auwb3uofyxx,sieves,"They want no sieve, but they want %%.",40,male,english,50,sieve,0
zjm7auwb3uofyxx,hornets,"He wants no hornet, but he wants %%.",40,male,english,36,hornet,0
zjm7auwb3uofyxx,chairs,She wants a chair and she wants %%.,40,male,english,3,chair,1
zjm7auwb3uofyxx,toasters,"You want no toaster, but you want %%.",40,male,english,6,toaster,0
zjm7auwb3uofyxx,frogs,He wants a frog and he wants %%.,40,male,english,45,frog,1
zjm7auwb3uofyxx,lemons,You want a lemon and you want %%.,40,male,english,40,lemon,1
zjm7auwb3uofyxx,geese,"She wants no goose, but she wants %%.",40,male,english,5,goose,0
zjm7auwb3uofyxx,bags,They want a bag and they want %%.,40,male,english,16,bag,1
zjm7auwb3uofyxx,giraffes,"You want no giraffe, but you want %%.",40,male,english,35,giraffe,0
zjm7auwb3uofyxx,flutes,"He wants no flute, but he wants %%.",40,male,english,28,flute,0
zjm7auwb3uofyxx,ferries,"They want no ferry, but they want %%.",40,male,english,19,ferry,0
zjm7auwb3uofyxx,corns,You want corn and you want %%.,40,male,english,7,corn,1
zjm7auwb3uofyxx,garlics,"They want no garlic, but they want %%.",40,male,english,14,garlic,0
zjm7auwb3uofyxx,lizards,"We want no lizard, but we want %%.",40,male,english,25,lizard,0
zjm7auwb3uofyxx,mugs,I want a mug and I want %%.,40,male,english,43,mug,1
zjm7auwb3uofyxx,alligators,They want an alligator and they want %%.,40,male,english,2,alligator,1
zjm7auwb3uofyxx,sparrows,"I want no sparrow, but I want %%.",40,male,english,41,sparrow,0
zjm7auwb3uofyxx,potatoes,I want a potato and I want %%.,40,male,english,37,potato,1
zjm7auwb3uofyxx,trouts,They want a trout and they want %%.,40,male,english,42,trout,1
zjm7auwb3uofyxx,freezers,"I want no freezer, but I want %%.",40,male,english,22,freezer,0
zjm7auwb3uofyxx,jackets,"We want no jacket, but we want %%.",40,male,english,13,jacket,0
zjm7auwb3uofyxx,trucks,"I want no truck, but I want %%.",40,male,english,11,truck,0
zjm7auwb3uofyxx,hawks,I want a hawk and I want %%.,40,male,english,32,hawk,1
zjm7auwb3uofyxx,goldfishes,"You want no goldfish, but you want %%.",40,male,english,30,goldfish,0
zjm7auwb3uofyxx,cypresses,He wants a cypress and he wants %%.,40,male,english,24,cypress,1
zjm7auwb3uofyxx,dresses,They want a dress and they want %%.,40,male,english,20,dress,1
zjm7auwb3uofyxx,cranberries,"She wants no cranberry, but she wants %%.",40,male,english,29,cranberry,0
zjm7auwb3uofyxx,libraries,"You want no library, but you want %%.",40,male,english,48,library,0
zjm7auwb3uofyxx,crows,I want a crow and I want %%.,40,male,english,34,crow,1
zjm7auwb3uofyxx,coats,We want a coat and we want %%.,40,male,english,27,coat,1
zjm7auwb3uofyxx,scooters,They want a scooter and they want %%.,40,male,english,33,scooter,1
zjm7auwb3uofyxx,daggers,We want a dagger and we want %%.,40,male,english,21,dagger,1
zjm7auwb3uofyxx,goats,She wants a goat and she wants %%.,40,male,english,1,goat,1
zjm7auwb3uofyxx,cats,"He wants no cat, but he wants %%.",40,male,english,18,cat,0
zjm7auwb3uofyxx,busses,She wants a bus and she wants %%.,40,male,english,9,bus,1
zjm7auwb3uofyxx,wasps,He wants a wasp and he wants %%.,40,male,english,23,wasp,1
qntrwv8u86q5fyy,table,"We want no chair, but we want %%.",47,female,english,3,chair,0
qntrwv8u86q5fyy,cat,"She wants no wasp, but she wants %%.",47,female,english,23,wasp,0
qntrwv8u86q5fyy,cat,"She wants no bus, but she wants %%.",47,female,english,9,bus,0
qntrwv8u86q5fyy,camel,They want a giraffe and they want %%.,47,female,english,35,giraffe,1
qntrwv8u86q5fyy,pan,"He wants no freezer, but he wants %%.",47,female,english,22,freezer,0
qntrwv8u86q5fyy,cat,"She wants no goat, but she wants %%.",47,female,english,1,goat,0
qntrwv8u86q5fyy,book,We want a lizard and we want %%.,47,female,english,25,lizard,1
qntrwv8u86q5fyy,cat,They want an oven and they want %%.,47,female,english,31,oven,1
qntrwv8u86q5fyy,dog,We want a yacht and we want %%.,47,female,english,4,yacht,1
qntrwv8u86q5fyy,tomato,"They want no corn, but they want %%.",47,female,english,7,corn,0
qntrwv8u86q5fyy,water,"He wants no bottle, but he wants %%.",47,female,english,39,bottle,0
qntrwv8u86q5fyy,parrot,"You want no sparrow, but you want %%.",47,female,english,41,sparrow,0
qntrwv8u86q5fyy,bus,You want a truck and you want %%.,47,female,english,11,truck,1
qntrwv8u86q5fyy,bike,"We want no scooter, but we want %%.",47,female,english,33,scooter,0
qntrwv8u86q5fyy,sand,"We want no sieve, but we want %%.",47,female,english,50,sieve,0
qntrwv8u86q5fyy,goat,He wants a hawk and he wants %%.,47,female,english,32,hawk,1
qntrwv8u86q5fyy,dress,They want a cypress and they want %%.,47,female,english,24,cypress,1
qntrwv8u86q5fyy,pan,We want a toaster and we want %%.,47,female,english,6,toaster,1
qntrwv8u86q5fyy,pan,We want a crow and we want %%.,47,female,english,34,crow,1
qntrwv8u86q5fyy,book,"He wants no library, but he wants %%.",47,female,english,48,library,0
qntrwv8u86q5fyy,parrot,They want a swan and they want %%.,47,female,english,17,swan,1
qntrwv8u86q5fyy,van,We want a beaver and we want %%.,47,female,english,38,beaver,1
qntrwv8u86q5fyy,radio,He wants a television and he wants %%.,47,female,english,44,television,1
qntrwv8u86q5fyy,paper,"I want no poplar, but I want %%.",47,female,english,49,poplar,0
qntrwv8u86q5fyy,cup,"I want no mug, but I want %%.",47,female,english,43,mug,0
qntrwv8u86q5fyy,parrot,"You want no goose, but you want %%.",47,female,english,5,goose,0
qntrwv8u86q5fyy,pool,They want garlic and they want %%.,47,female,english,14,garlic,1
qntrwv8u86q5fyy,dress,"She wants no shirt, but she wants %%.",47,female,english,10,shirt,0
qntrwv8u86q5fyy,book,"He wants no alligator, but he wants %%.",47,female,english,2,alligator,0
qntrwv8u86q5fyy,pan,We want a cranberry and we want %%.,47,female,english,29,cranberry,1
qntrwv8u86q5fyy,dog,We want a dagger and we want %%.,47,female,english,21,dagger,1
qntrwv8u86q5fyy,dog,"They want no broccoli, but they want %%.",47,female,english,15,broccoli,0
qntrwv8u86q5fyy,dog,I want a bag and I want %%.,47,female,english,16,bag,1
qntrwv8u86q5fyy,apple,"We want no lemon, but we want %%.",47,female,english,40,lemon,0
qntrwv8u86q5fyy,dress,We want a jacket and we want %%.,47,female,english,13,jacket,1
qntrwv8u86q5fyy,dog,She wants a trout and she wants %%.,47,female,english,42,trout,1
qntrwv8u86q5fyy,dog,He wants a cat and he wants %%.,47,female,english,18,cat,1
qntrwv8u86q5fyy,dog,She wants a radio and she wants %%.,47,female,english,46,radio,1
qntrwv8u86q5fyy,cow,"I want no deer, but I want %%.",47,female,english,12,deer,0
qntrwv8u86q5fyy,tomato,"You want no potato, but you want %%.",47,female,english,37,potato,0
qntrwv8u86q5fyy,pool,"You want no castle, but you want %%.",47,female,english,47,castle,0
qntrwv8u86q5fyy,top,"He wants no coat, but he wants %%.",47,female,english,27,coat,0
qntrwv8u86q5fyy,goat,You want a ferry and you want %%.,47,female,english,19,ferry,1
qntrwv8u86q5fyy,cow,He wants a frog and he wants %%.,47,female,english,45,frog,1
qntrwv8u86q5fyy,dog,I want a dress and I want %%.,47,female,english,20,dress,1
