Subject,Answer,Sentence,Age,Gender,Language,Item,Noun,Polarity
zvq74arjfvnaww2,yes,They want a trumpet and they want %%.,26,female,english,26,trumpet,1
zvq74arjfvnaww2,yes,I want a dagger and I want %%.,26,female,english,21,dagger,1
zvq74arjfvnaww2,yes,"They want no dress, but they want %%.",26,female,english,20,dress,0
zvq74arjfvnaww2,yes,"She wants no coat, but she wants %%.",26,female,english,27,coat,0
zvq74arjfvnaww2,yes,"She wants no sieve, but she wants %%.",26,female,english,50,sieve,0
zvq74arjfvnaww2,yes,"She wants no truck, but she wants %%.",26,female,english,11,truck,0
zvq74arjfvnaww2,yes,"We want no scooter, but we want %%.",26,female,english,33,scooter,0
zvq74arjfvnaww2,yes,He wants a yacht and he wants %%.,26,female,english,4,yacht,1
zvq74arjfvnaww2,yes,"You want no swan, but you want %%.",26,female,english,17,swan,0
zvq74arjfvnaww2,yes,"He wants no chair, but he wants %%.",26,female,english,3,chair,0
zvq74arjfvnaww2,yes,He wants a cat and he wants %%.,26,female,english,18,cat,1
zvq74arjfvnaww2,yes,"She wants no garlic, but she wants %%.",26,female,english,14,garlic,0
zvq74arjfvnaww2,yes,"They want no freezer, but they want %%.",26,female,english,22,freezer,0
zvq74arjfvnaww2,yes,"We want no broccoli, but we want %%.",26,female,english,15,broccoli,0
zvq74arjfvnaww2,yes,She wants a jacket and she wants %%.,26,female,english,13,jacket,1
zvq74arjfvnaww2,yes,"You want no falcon, but you want %%.",26,female,english,8,falcon,0
zvq74arjfvnaww2,yes,"I want no hornet, but I want %%.",26,female,english,36,hornet,0
zvq74arjfvnaww2,yes,He wants a giraffe and he wants %%.,26,female,english,35,giraffe,1
zvq74arjfvnaww2,yes,She wants a radio and she wants %%.,26,female,english,46,radio,1
zvq74arjfvnaww2,yes,You want a sparrow and you want %%.,26,female,english,41,sparrow,1
zvq74arjfvnaww2,yes,"He wants no flute, but he wants %%.",26,female,english,28,flute,0
zvq74arjfvnaww2,yes,You want corn and you want %%.,26,female,english,7,corn,1
zvq74arjfvnaww2,yes,He wants a wasp and he wants %%.,26,female,english,23,wasp,1
zvq74arjfvnaww2,yes,You want a cypress and you want %%.,26,female,english,24,cypress,1
zvq74arjfvnaww2,yes,I want a goose and I want %%.,26,female,english,5,goose,1
zvq74arjfvnaww2,yes,I want a beaver and I want %%.,26,female,english,38,beaver,1
zvq74arjfvnaww2,yes,She wants a bus and she wants %%.,26,female,english,9,bus,1
zvq74arjfvnaww2,yes,"We want no ferry, but we want %%.",26,female,english,19,ferry,0
zvq74arjfvnaww2,yes,They want a trout and they want %%.,26,female,english,42,trout,1
9rwrtkx25z3eanf,bug,You want a bag and you want %%.,48,male,english,16,bag,1
jz806waakna2fnq,table,"I want no chair, but I want %%.",66,female,english,3,chair,0
jz806waakna2fnq,plants,"He wants no cypress, but he wants %%.",66,female,english,24,cypress,0
jz806waakna2fnq,eagle,He wants a hawk and he wants %%.,66,female,english,32,hawk,1
jz806waakna2fnq,dog,She wants a frog and she wants %%.,66,female,english,45,frog,1
jz806waakna2fnq,induction,He wants an oven and he wants %%.,66,female,english,31,oven,1
jz806waakna2fnq,lorry,We want a truck and we want %%.,66,female,english,11,truck,1
jz806waakna2fnq,parrot,They want a sparrow and they want %%.,66,female,english,41,sparrow,1
jz806waakna2fnq,boat,I want a yacht and I want %%.,66,female,english,4,yacht,1
jz806waakna2fnq,snacks,You want corn and you want %%.,66,female,english,7,corn,1
jz806waakna2fnq,zebra,"She wants no deer, but she wants %%.",66,female,english,12,deer,0
jz806waakna2fnq,house,She wants a castle and she wants %%.,66,female,english,47,castle,1
jz806waakna2fnq,t-shirt,"She wants no coat, but she wants %%.",66,female,english,27,coat,0
jz806waakna2fnq,basketball,"We want no scooter, but we want %%.",66,female,english,33,scooter,0
jz806waakna2fnq,knife,"She wants no toaster, but she wants %%.",66,female,english,6,toaster,0
jz806waakna2fnq,boat,We want a ferry and we want %%.,66,female,english,19,ferry,1
jz806waakna2fnq,television,"They want no radio, but they want %%.",66,female,english,46,radio,0
jz806waakna2fnq,knife,She wants a dagger and she wants %%.,66,female,english,21,dagger,1
jz806waakna2fnq,peacock,He wants a goose and he wants %%.,66,female,english,5,goose,1
jz806waakna2fnq,deer,She wants a giraffe and she wants %%.,66,female,english,35,giraffe,1
jz806waakna2fnq,strawberry,"He wants no cranberry, but he wants %%.",66,female,english,29,cranberry,0
jz806waakna2fnq,dog,"You want no cat, but you want %%.",66,female,english,18,cat,0
jz806waakna2fnq,eagle,I want a crow and I want %%.,66,female,english,34,crow,1
jz806waakna2fnq,parrots,We want a falcon and we want %%.,66,female,english,8,falcon,1
jz806waakna2fnq,sparrow,"We want no swan, but we want %%.",66,female,english,17,swan,0
jz806waakna2fnq,carrots,You want broccoli and you want %%.,66,female,english,15,broccoli,1
recombahw89mt4y,good,"She wants no trout, but she wants %%.",30,male,english,42,trout,0
recombahw89mt4y,good,"I want no deer, but I want %%.",30,male,english,12,deer,0
recombahw89mt4y,good,I want a giraffe and I want %%.,30,male,english,35,giraffe,1
recombahw89mt4y,good,"They want no radio, but they want %%.",30,male,english,46,radio,0
recombahw89mt4y,pant,She wants a shirt and she wants %%.,30,male,english,10,shirt,1
recombahw89mt4y,shoe,You want a bag and you want %%.,30,male,english,16,bag,1
recombahw89mt4y,gun,"We want no mug, but we want %%.",30,male,english,43,mug,0
recombahw89mt4y,trump,"I want no trumpet, but I want %%.",30,male,english,26,trumpet,0
recombahw89mt4y,god,You want a potato and you want %%.,30,male,english,37,potato,1
recombahw89mt4y,bike,She wants a scooter and she wants %%.,30,male,english,33,scooter,1
recombahw89mt4y,pops,"I want no poplar, but I want %%.",30,male,english,49,poplar,0
recombahw89mt4y,good,"She wants no goat, but she wants %%.",30,male,english,1,goat,0
recombahw89mt4y,cow,I want a coat and I want %%.,30,male,english,27,coat,1
recombahw89mt4y,cow,"She wants no sparrow, but she wants %%.",30,male,english,41,sparrow,0
recombahw89mt4y,chari,"She wants no chair, but she wants %%.",30,male,english,3,chair,0
recombahw89mt4y,good,"You want no bus, but you want %%.",30,male,english,9,bus,0
oha3dk070k9px7k,fish,"They want no goldfish, but they want %%.",27,female,english,30,goldfish,0
oha3dk070k9px7k,drive,"You want no dagger, but you want %%.",27,female,english,21,dagger,0
oha3dk070k9px7k,cran,She wants a cranberry and she wants %%.,27,female,english,29,cranberry,1
oha3dk070k9px7k,tea,They want a sieve and they want %%.,27,female,english,50,sieve,1
oha3dk070k9px7k,drive,"We want no scooter, but we want %%.",27,female,english,33,scooter,0
oha3dk070k9px7k,ice,"She wants no freezer, but she wants %%.",27,female,english,22,freezer,0
oha3dk070k9px7k,ship,They want a ferry and they want %%.,27,female,english,19,ferry,1
oha3dk070k9px7k,water,You want a frog and you want %%.,27,female,english,45,frog,1
oha3dk070k9px7k,dress,"He wants no shirt, but he wants %%.",27,female,english,10,shirt,0
oha3dk070k9px7k,sty,You want broccoli and you want %%.,27,female,english,15,broccoli,1
oha3dk070k9px7k,fair,"He wants no lizard, but he wants %%.",27,female,english,25,lizard,0
oha3dk070k9px7k,music,"We want no flute, but we want %%.",27,female,english,28,flute,0
oha3dk070k9px7k,movies,He wants a television and he wants %%.,27,female,english,44,television,1
oha3dk070k9px7k,dog,"They want no cat, but they want %%.",27,female,english,18,cat,0
oha3dk070k9px7k,animal,"They want no giraffe, but they want %%.",27,female,english,35,giraffe,0
oha3dk070k9px7k,tomato,She wants a potato and she wants %%.,27,female,english,37,potato,1
oha3dk070k9px7k,fish,"You want no goose, but you want %%.",27,female,english,5,goose,0
oha3dk070k9px7k,fish,They want an alligator and they want %%.,27,female,english,2,alligator,1
oha3dk070k9px7k,tops,She wants a dress and she wants %%.,27,female,english,20,dress,1
oha3dk070k9px7k,tea,She wants a mug and she wants %%.,27,female,english,43,mug,1
oha3dk070k9px7k,butter,"She wants no toaster, but she wants %%.",27,female,english,6,toaster,0
oha3dk070k9px7k,books,You want a library and you want %%.,27,female,english,48,library,1
oha3dk070k9px7k,water,"He wants no castle, but he wants %%.",27,female,english,47,castle,0
oha3dk070k9px7k,dress,They want a jacket and they want %%.,27,female,english,13,jacket,1
oha3dk070k9px7k,water,"You want no bottle, but you want %%.",27,female,english,39,bottle,0
oha3dk070k9px7k,music,"He wants no radio, but he wants %%.",27,female,english,46,radio,0
oha3dk070k9px7k,cat,I want a goat and I want %%.,27,female,english,1,goat,1
oha3dk070k9px7k,dress,"I want no coat, but I want %%.",27,female,english,27,coat,0
oha3dk070k9px7k,tomato,We want garlic and we want %%.,27,female,english,14,garlic,1
oha3dk070k9px7k,tree,You want a chair and you want %%.,27,female,english,3,chair,1
oha3dk070k9px7k,cook,He wants an oven and he wants %%.,27,female,english,31,oven,1
oha3dk070k9px7k,sty,"You want no falcon, but you want %%.",27,female,english,8,falcon,0
oha3dk070k9px7k,book,We want a bag and we want %%.,27,female,english,16,bag,1
oha3dk070k9px7k,bus,"She wants no truck, but she wants %%.",27,female,english,11,truck,0
hm0w2oaprh035tc,yes,"I want no goose, but I want %%.",26,female,english,5,goose,0
hm0w2oaprh035tc,yes,He wants a toaster and he wants %%.,26,female,english,6,toaster,1
hm0w2oaprh035tc,yes,"I want no radio, but I want %%.",26,female,english,46,radio,0
hm0w2oaprh035tc,yes,"She wants no alligator, but she wants %%.",26,female,english,2,alligator,0
hm0w2oaprh035tc,yes,You want a dress and you want %%.,26,female,english,20,dress,1
hm0w2oaprh035tc,yes,"He wants no lemon, but he wants %%.",26,female,english,40,lemon,0
hm0w2oaprh035tc,yes,You want a library and you want %%.,26,female,english,48,library,1
hm0w2oaprh035tc,yes,"He wants no cat, but he wants %%.",26,female,english,18,cat,0
hm0w2oaprh035tc,yes,"I want no goldfish, but I want %%.",26,female,english,30,goldfish,0
hm0w2oaprh035tc,yes,You want a wasp and you want %%.,26,female,english,23,wasp,1
hm0w2oaprh035tc,yes,I want a yacht and I want %%.,26,female,english,4,yacht,1
hm0w2oaprh035tc,yes,"He wants no chair, but he wants %%.",26,female,english,3,chair,0
hm0w2oaprh035tc,yes,You want an oven and you want %%.,26,female,english,31,oven,1
hm0w2oaprh035tc,yes,He wants a flute and he wants %%.,26,female,english,28,flute,1
hm0w2oaprh035tc,yes,"He wants no poplar, but he wants %%.",26,female,english,49,poplar,0
hm0w2oaprh035tc,yes,We want a swan and we want %%.,26,female,english,17,swan,1
hm0w2oaprh035tc,yes,I want a television and I want %%.,26,female,english,44,television,1
hm0w2oaprh035tc,yes,"They want no garlic, but they want %%.",26,female,english,14,garlic,0
hm0w2oaprh035tc,yes,You want a bus and you want %%.,26,female,english,9,bus,1
hm0w2oaprh035tc,yes,You want a coat and you want %%.,26,female,english,27,coat,1
hm0w2oaprh035tc,yes,"We want no broccoli, but we want %%.",26,female,english,15,broccoli,0
hm0w2oaprh035tc,yes,You want a cypress and you want %%.,26,female,english,24,cypress,1
hm0w2oaprh035tc,yes,"I want no dagger, but I want %%.",26,female,english,21,dagger,0
hm0w2oaprh035tc,yes,You want a falcon and you want %%.,26,female,english,8,falcon,1
hm0w2oaprh035tc,yes,"We want no hornet, but we want %%.",26,female,english,36,hornet,0
hm0w2oaprh035tc,yes,You want a truck and you want %%.,26,female,english,11,truck,1
hm0w2oaprh035tc,yes,We want a sieve and we want %%.,26,female,english,50,sieve,1
hm0w2oaprh035tc,yes,She wants a mug and she wants %%.,26,female,english,43,mug,1
hm0w2oaprh035tc,yes,"She wants no hawk, but she wants %%.",26,female,english,32,hawk,0
hm0w2oaprh035tc,yes,"We want no corn, but we want %%.",26,female,english,7,corn,0
hm0w2oaprh035tc,yes,They want a goat and they want %%.,26,female,english,1,goat,1
hm0w2oaprh035tc,yes,"We want no bottle, but we want %%.",26,female,english,39,bottle,0
hm0w2oaprh035tc,yes,"We want no deer, but we want %%.",26,female,english,12,deer,0
hm0w2oaprh035tc,yes,I want a jacket and I want %%.,26,female,english,13,jacket,1
hm0w2oaprh035tc,yes,She wants a frog and she wants %%.,26,female,english,45,frog,1
hm0w2oaprh035tc,yes,"She wants no sparrow, but she wants %%.",26,female,english,41,sparrow,0
hm0w2oaprh035tc,yes,We want a trumpet and we want %%.,26,female,english,26,trumpet,1
hm0w2oaprh035tc,yes,"He wants no cranberry, but he wants %%.",26,female,english,29,cranberry,0
hm0w2oaprh035tc,yes,"You want no ferry, but you want %%.",26,female,english,19,ferry,0
hm0w2oaprh035tc,yes,You want a shirt and you want %%.,26,female,english,10,shirt,1
hm0w2oaprh035tc,yes,I want a bag and I want %%.,26,female,english,16,bag,1
hm0w2oaprh035tc,leave,They want a trout and they want %%.,26,female,english,42,trout,1
hm0w2oaprh035tc,yes,"You want no castle, but you want %%.",26,female,english,47,castle,0
hm0w2oaprh035tc,yes,We want a potato and we want %%.,26,female,english,37,potato,1
hm0w2oaprh035tc,yes,I want a beaver and I want %%.,26,female,english,38,beaver,1
hm0w2oaprh035tc,yes,You want a giraffe and you want %%.,26,female,english,35,giraffe,1
hm0w2oaprh035tc,yes,"I want no crow, but I want %%.",26,female,english,34,crow,0
hm0w2oaprh035tc,yes,He wants a scooter and he wants %%.,26,female,english,33,scooter,1
hm0w2oaprh035tc,yes,"You want no freezer, but you want %%.",26,female,english,22,freezer,0
hm0w2oaprh035tc,yes,We want a lizard and we want %%.,26,female,english,25,lizard,1
azd5ruj6oojoe1w,shoes,I want a dress and I want %%.,29,female,english,20,dress,1
azd5ruj6oojoe1w,plate,"He wants no sieve, but he wants %%.",29,female,english,50,sieve,0
azd5ruj6oojoe1w,fridge,I want a freezer and I want %%.,29,female,english,22,freezer,1
azd5ruj6oojoe1w,fish,She wants a goldfish and she wants %%.,29,female,english,30,goldfish,1
azd5ruj6oojoe1w,gas,"They want no oven, but they want %%.",29,female,english,31,oven,0
azd5ruj6oojoe1w,chick,They want a hawk and they want %%.,29,female,english,32,hawk,1
azd5ruj6oojoe1w,pant,You want a coat and you want %%.,29,female,english,27,coat,1
azd5ruj6oojoe1w,fly,You want a lizard and you want %%.,29,female,english,25,lizard,1
azd5ruj6oojoe1w,water,They want a bottle and they want %%.,29,female,english,39,bottle,1
azd5ruj6oojoe1w,book,She wants a library and she wants %%.,29,female,english,48,library,1
azd5ruj6oojoe1w,pant,We want a shirt and we want %%.,29,female,english,10,shirt,1
azd5ruj6oojoe1w,song,"They want no radio, but they want %%.",29,female,english,46,radio,0
azd5ruj6oojoe1w,cinema,He wants a television and he wants %%.,29,female,english,44,television,1
azd5ruj6oojoe1w,rat,We want a cat and we want %%.,29,female,english,18,cat,1
azd5ruj6oojoe1w,camel,She wants a giraffe and she wants %%.,29,female,english,35,giraffe,1
azd5ruj6oojoe1w,stool,They want a chair and they want %%.,29,female,english,3,chair,1
azd5ruj6oojoe1w,paper,I want a poplar and I want %%.,29,female,english,49,poplar,1
azd5ruj6oojoe1w,fish,She wants a yacht and she wants %%.,29,female,english,4,yacht,1
azd5ruj6oojoe1w,meat,"We want no bag, but we want %%.",29,female,english,16,bag,0
azd5ruj6oojoe1w,fish,They want a frog and they want %%.,29,female,english,45,frog,1
azd5ruj6oojoe1w,rout,"You want no trout, but you want %%.",29,female,english,42,trout,0
azd5ruj6oojoe1w,tablet,"You want no garlic, but you want %%.",29,female,english,14,garlic,0
azd5ruj6oojoe1w,small,You want a beaver and you want %%.,29,female,english,38,beaver,1
azd5ruj6oojoe1w,sugar,I want a lemon and I want %%.,29,female,english,40,lemon,1
azd5ruj6oojoe1w,fish,"They want no swan, but they want %%.",29,female,english,17,swan,0
azd5ruj6oojoe1w,fish,"We want no sparrow, but we want %%.",29,female,english,41,sparrow,0
azd5ruj6oojoe1w,fish,I want a castle and I want %%.,29,female,english,47,castle,1
azd5ruj6oojoe1w,stick,I want a trumpet and I want %%.,29,female,english,26,trumpet,1
azd5ruj6oojoe1w,fish,He wants a jacket and he wants %%.,29,female,english,13,jacket,1
azd5ruj6oojoe1w,meat,I want a dagger and I want %%.,29,female,english,21,dagger,1
azd5ruj6oojoe1w,man,"He wants no scooter, but he wants %%.",29,female,english,33,scooter,0
azd5ruj6oojoe1w,passenger,"We want no bus, but we want %%.",29,female,english,9,bus,0
azd5ruj6oojoe1w,hen,"She wants no ferry, but she wants %%.",29,female,english,19,ferry,0
azd5ruj6oojoe1w,hen,"He wants no goose, but he wants %%.",29,female,english,5,goose,0
azd5ruj6oojoe1w,gun,"I want no falcon, but I want %%.",29,female,english,8,falcon,0
azd5ruj6oojoe1w,water,He wants a mug and he wants %%.,29,female,english,43,mug,1
azd5ruj6oojoe1w,mud,We want a truck and we want %%.,29,female,english,11,truck,1
azd5ruj6oojoe1w,fish,You want a hornet and you want %%.,29,female,english,36,hornet,1
azd5ruj6oojoe1w,fish,He wants corn and he wants %%.,29,female,english,7,corn,1
azd5ruj6oojoe1w,bread,"You want no toaster, but you want %%.",29,female,english,6,toaster,0
azd5ruj6oojoe1w,fish,"She wants no broccoli, but she wants %%.",29,female,english,15,broccoli,0
azd5ruj6oojoe1w,guitar,"You want no flute, but you want %%.",29,female,english,28,flute,0
azd5ruj6oojoe1w,dog,You want a deer and you want %%.,29,female,english,12,deer,1
azd5ruj6oojoe1w,sheep,"I want no goat, but I want %%.",29,female,english,1,goat,0
azd5ruj6oojoe1w,chips,He wants a potato and he wants %%.,29,female,english,37,potato,1
azd5ruj6oojoe1w,ship,"I want no wasp, but I want %%.",29,female,english,23,wasp,0
azd5ruj6oojoe1w,bag,"You want no crow, but you want %%.",29,female,english,34,crow,0
b8dok501m6kwyvy,water,"They want no giraffe, but they want %%.",29,male,english,35,giraffe,0
b8dok501m6kwyvy,water,"They want no freezer, but they want %%.",29,male,english,22,freezer,0
b8dok501m6kwyvy,pant,She wants a shirt and she wants %%.,29,male,english,10,shirt,1
b8dok501m6kwyvy,water,He wants a mug and he wants %%.,29,male,english,43,mug,1
b8dok501m6kwyvy,book,"They want no bag, but they want %%.",29,male,english,16,bag,0
b8dok501m6kwyvy,pet,"You want no lizard, but you want %%.",29,male,english,25,lizard,0
b8dok501m6kwyvy,tomato,"You want no potato, but you want %%.",29,male,english,37,potato,0
b8dok501m6kwyvy,honey,They want a hornet and they want %%.,29,male,english,36,hornet,1
b8dok501m6kwyvy,cat,You want a goldfish and you want %%.,29,male,english,30,goldfish,1
b8dok501m6kwyvy,pan,He wants an oven and he wants %%.,29,male,english,31,oven,1
b8dok501m6kwyvy,parrot,"They want no crow, but they want %%.",29,male,english,34,crow,0
b8dok501m6kwyvy,bridge,I want a television and I want %%.,29,male,english,44,television,1
b8dok501m6kwyvy,dog,"She wants no frog, but she wants %%.",29,male,english,45,frog,0
b8dok501m6kwyvy,piano,They want a trumpet and they want %%.,29,male,english,26,trumpet,1
b8dok501m6kwyvy,potato,He wants corn and he wants %%.,29,male,english,7,corn,1
b8dok501m6kwyvy,bike,You want a scooter and you want %%.,29,male,english,33,scooter,1
rbugwbt4uqxrozu,swan,"They want no sieve, but they want %%.",47,female,english,50,sieve,0
rbugwbt4uqxrozu,deer,"We want no beaver, but we want %%.",47,female,english,38,beaver,0
rbugwbt4uqxrozu,flag,I want a falcon and I want %%.,47,female,english,8,falcon,1
rbugwbt4uqxrozu,popcorn,We want a poplar and we want %%.,47,female,english,49,poplar,1
rbugwbt4uqxrozu,cat,She wants a deer and she wants %%.,47,female,english,12,deer,1
rbugwbt4uqxrozu,cat,She wants a crow and she wants %%.,47,female,english,34,crow,1
rbugwbt4uqxrozu,popcorn,We want corn and we want %%.,47,female,english,7,corn,1
rbugwbt4uqxrozu,lemon,"They want no trumpet, but they want %%.",47,female,english,26,trumpet,0
rbugwbt4uqxrozu,crow,She wants a hawk and she wants %%.,47,female,english,32,hawk,1
rbugwbt4uqxrozu,deer,He wants a coat and he wants %%.,47,female,english,27,coat,1
rbugwbt4uqxrozu,elephant,They want an oven and they want %%.,47,female,english,31,oven,1
rbugwbt4uqxrozu,cow,You want a ferry and you want %%.,47,female,english,19,ferry,1
rbugwbt4uqxrozu,camera,"You want no freezer, but you want %%.",47,female,english,22,freezer,0
rbugwbt4uqxrozu,tomato,You want a potato and you want %%.,47,female,english,37,potato,1
rbugwbt4uqxrozu,car,"We want no television, but we want %%.",47,female,english,44,television,0
rbugwbt4uqxrozu,book,"You want no goose, but you want %%.",47,female,english,5,goose,0
rbugwbt4uqxrozu,bag,I want a bottle and I want %%.,47,female,english,39,bottle,1
rbugwbt4uqxrozu,coat,You want a jacket and you want %%.,47,female,english,13,jacket,1
rbugwbt4uqxrozu,television,"We want no radio, but we want %%.",47,female,english,46,radio,0
rbugwbt4uqxrozu,lemon,"They want no garlic, but they want %%.",47,female,english,14,garlic,0
rbugwbt4uqxrozu,car,We want a scooter and we want %%.,47,female,english,33,scooter,1
rbugwbt4uqxrozu,coat,They want a shirt and they want %%.,47,female,english,10,shirt,1
rbugwbt4uqxrozu,blueberry,He wants a cranberry and he wants %%.,47,female,english,29,cranberry,1
rbugwbt4uqxrozu,garlic,He wants a giraffe and he wants %%.,47,female,english,35,giraffe,1
rbugwbt4uqxrozu,flag,"They want no frog, but they want %%.",47,female,english,45,frog,0
rbugwbt4uqxrozu,temple,"He wants no mug, but he wants %%.",47,female,english,43,mug,0
rbugwbt4uqxrozu,temple,"They want no castle, but they want %%.",47,female,english,47,castle,0
rbugwbt4uqxrozu,bread,You want a toaster and you want %%.,47,female,english,6,toaster,1
rbugwbt4uqxrozu,elephant,They want an alligator and they want %%.,47,female,english,2,alligator,1
rbugwbt4uqxrozu,cycle,"We want no cypress, but we want %%.",47,female,english,24,cypress,0
rbugwbt4uqxrozu,dog,She wants a dagger and she wants %%.,47,female,english,21,dagger,1
rbugwbt4uqxrozu,book,She wants a bag and she wants %%.,47,female,english,16,bag,1
rbugwbt4uqxrozu,cat,We want a goat and we want %%.,47,female,english,1,goat,1
rbugwbt4uqxrozu,can,I want a hornet and I want %%.,47,female,english,36,hornet,1
rbugwbt4uqxrozu,car,You want a bus and you want %%.,47,female,english,9,bus,1
rbugwbt4uqxrozu,tomato,They want a lemon and they want %%.,47,female,english,40,lemon,1
rbugwbt4uqxrozu,table,He wants a chair and he wants %%.,47,female,english,3,chair,1
rbugwbt4uqxrozu,coat,He wants a dress and he wants %%.,47,female,english,20,dress,1
rbugwbt4uqxrozu,car,I want a truck and I want %%.,47,female,english,11,truck,1
rbugwbt4uqxrozu,dog,"You want no cat, but you want %%.",47,female,english,18,cat,0
rbugwbt4uqxrozu,butterfly,They want a lizard and they want %%.,47,female,english,25,lizard,1
rbugwbt4uqxrozu,book,They want a library and they want %%.,47,female,english,48,library,1
ske08hl8uwdflmb,water,"He wants no sieve, but he wants %%.",21,female,english,50,sieve,0
ske08hl8uwdflmb,cup,"I want no beaver, but I want %%.",21,female,english,38,beaver,0
ske08hl8uwdflmb,ship,She wants a ferry and she wants %%.,21,female,english,19,ferry,1
ske08hl8uwdflmb,guitar,"We want no flute, but we want %%.",21,female,english,28,flute,0
ske08hl8uwdflmb,bowl,I want a lizard and I want %%.,21,female,english,25,lizard,1
ske08hl8uwdflmb,tomato,"I want no potato, but I want %%.",21,female,english,37,potato,0
ske08hl8uwdflmb,train,"We want no bus, but we want %%.",21,female,english,9,bus,0
ske08hl8uwdflmb,ginger,I want garlic and I want %%.,21,female,english,14,garlic,1
ske08hl8uwdflmb,peacock,"They want no crow, but they want %%.",21,female,english,34,crow,0
ske08hl8uwdflmb,butterfly,"He wants no wasp, but he wants %%.",21,female,english,23,wasp,0
ske08hl8uwdflmb,clothes,"He wants no shirt, but he wants %%.",21,female,english,10,shirt,0
ske08hl8uwdflmb,shirt,"They want no dress, but they want %%.",21,female,english,20,dress,0
ske08hl8uwdflmb,crow,She wants a goose and she wants %%.,21,female,english,5,goose,1
ske08hl8uwdflmb,orange,"She wants no lemon, but she wants %%.",21,female,english,40,lemon,0
ske08hl8uwdflmb,books,"He wants no library, but he wants %%.",21,female,english,48,library,0
ske08hl8uwdflmb,dress,"He wants no jacket, but he wants %%.",21,female,english,13,jacket,0
ske08hl8uwdflmb,hat,She wants a coat and she wants %%.,21,female,english,27,coat,1
ske08hl8uwdflmb,crocodile,"He wants no alligator, but he wants %%.",21,female,english,2,alligator,0
ske08hl8uwdflmb,goose,"I want no swan, but I want %%.",21,female,english,17,swan,0
ske08hl8uwdflmb,sheep,"We want no goat, but we want %%.",21,female,english,1,goat,0
ske08hl8uwdflmb,home,"We want no castle, but we want %%.",21,female,english,47,castle,0
ske08hl8uwdflmb,guitar,They want a trumpet and they want %%.,21,female,english,26,trumpet,1
ske08hl8uwdflmb,eagle,"She wants no hawk, but she wants %%.",21,female,english,32,hawk,0
ske08hl8uwdflmb,wood,"I want no poplar, but I want %%.",21,female,english,49,poplar,0
ske08hl8uwdflmb,dog,"They want no cat, but they want %%.",21,female,english,18,cat,0
ske08hl8uwdflmb,tv,"You want no radio, but you want %%.",21,female,english,46,radio,0
ske08hl8uwdflmb,ship,They want a yacht and they want %%.,21,female,english,4,yacht,1
ske08hl8uwdflmb,deer,I want a giraffe and I want %%.,21,female,english,35,giraffe,1
ske08hl8uwdflmb,chips,You want corn and you want %%.,21,female,english,7,corn,1
ske08hl8uwdflmb,sparrow,"We want no falcon, but we want %%.",21,female,english,8,falcon,0
ske08hl8uwdflmb,table,I want a chair and I want %%.,21,female,english,3,chair,1
ske08hl8uwdflmb,mobile,"They want no television, but they want %%.",21,female,english,44,television,0
ske08hl8uwdflmb,fish,"We want no frog, but we want %%.",21,female,english,45,frog,0
ske08hl8uwdflmb,cabbage,"We want no broccoli, but we want %%.",21,female,english,15,broccoli,0
ske08hl8uwdflmb,whale,She wants a trout and she wants %%.,21,female,english,42,trout,1
ske08hl8uwdflmb,cup,"They want no bottle, but they want %%.",21,female,english,39,bottle,0
ske08hl8uwdflmb,bike,"You want no scooter, but you want %%.",21,female,english,33,scooter,0
ske08hl8uwdflmb,parrot,"You want no sparrow, but you want %%.",21,female,english,41,sparrow,0
ske08hl8uwdflmb,ice,"You want no freezer, but you want %%.",21,female,english,22,freezer,0
ske08hl8uwdflmb,bottle,You want a mug and you want %%.,21,female,english,43,mug,1
